{
  "schemaVersion": 1,
  "decisionDate": "2026-08-21",
  "targetBase": "7e99fcbfa6aa71857866a0d10f54ca22f76d8433",
  "targetBaseSourceManifestSha256": "6dc37673c8c360aed62ee0ea585042d7e1a0f7507d30832aa5b9e8fef9a06d2f",
  "sourceManifestSha256": "35d5e53ca38105779af4758bc8ee22ab90ae487f8e64c294bd8eb825634c92a9",
  "toolchain": {
    "node": "v24.19.0",
    "nodeLtsLine": "24",
    "npm": "11.17.0",
    "git": "git version 2.39.5",
    "python": "Python 3.11.2",
    "pythonExecutable": "/usr/bin/python3.11",
    "pythonExecutableSha256": "6d972cf21be56fe3c947ab6ba257ff8d08c342dd2714442986791bd9a6dfabfe",
    "uv": "uv 0.11.26 (x86_64-unknown-linux-gnu)",
    "contractSchemaBundleSha256": "86118dae2350253279d89c03b21007be3d0b9686c88a1ebb9a02457d6e6a3241",
    "gitFilterRepo": {
      "packageVersion": "2.47.0",
      "reportedVersion": "a40bce548d2c",
      "artifactPath": ".migration-work/artifacts/git_filter_repo.py",
      "artifactSha256": "67447413e273fc76809289111748870b6f6072f08b17efe94863a92d810b7d94",
      "wrapperPath": ".migration-work/bin/git-filter-repo",
      "wrapperSha256": "17403d5733cbb7594ac1f0b28caba0e8842fbfcbb28a7572a90f2a8524872945"
    },
    "contractSchemaValidator": {
      "name": "ui-router-contract-validator",
      "version": "1",
      "artifactPath": "tools/validate-migration-contract.mjs",
      "artifactSha256": "848e1fd4c096a7858d6481148d0705776237dcfeec9c9dc533aa638740df73ae"
    },
    "runtime": {
      "osImage": "uirouter-h01:2026-08-21",
      "osImageDigest": "sha256:56ab6ddaab798f0664b18448a1226bfa9e43aefaa90af280ff79d05c350a2ef8",
      "architecture": "x64",
      "timezone": "UTC",
      "locale": "C",
      "browser": null
    }
  },
  "sources": [
    {
      "name": "core",
      "defaultHead": "c647c9c5aceb7057a965a0ec039b13bea17119a5",
      "tagSnapshotSha256": "eaab853a381899cdc496328ce2b4e04e5639475fcee242f556bbfc50fa0176a3",
      "mirrorPath": ".migration-work/sources/core.git",
      "bundlePath": ".migration-work/bundles/core.bundle",
      "bundleSha256": "32186126a53f0800c69081ca0bbc65b8a3579fcd35b123877a71176a5dbc9555",
      "objectFormat": "sha1",
      "includedRefs": [
        "refs/heads/master",
        "refs/tags/1.0.0",
        "refs/tags/1.0.0-alpha.1",
        "refs/tags/1.0.0-alpha.2",
        "refs/tags/1.0.0-alpha.3",
        "refs/tags/1.0.0-alpha.4",
        "refs/tags/1.0.0-alpha.5",
        "refs/tags/1.0.0-beta.1",
        "refs/tags/1.0.0-beta.2",
        "refs/tags/1.0.0-beta.3",
        "refs/tags/1.0.1",
        "refs/tags/2.0.0",
        "refs/tags/3.0.0",
        "refs/tags/3.1.0",
        "refs/tags/3.1.1",
        "refs/tags/4.0.0",
        "refs/tags/5.0.0",
        "refs/tags/5.0.0-pre.1",
        "refs/tags/5.0.0-pre.2",
        "refs/tags/5.0.1",
        "refs/tags/5.0.10",
        "refs/tags/5.0.11",
        "refs/tags/5.0.12",
        "refs/tags/5.0.13",
        "refs/tags/5.0.14",
        "refs/tags/5.0.15",
        "refs/tags/5.0.16",
        "refs/tags/5.0.17",
        "refs/tags/5.0.18",
        "refs/tags/5.0.19",
        "refs/tags/5.0.2",
        "refs/tags/5.0.20",
        "refs/tags/5.0.21",
        "refs/tags/5.0.22",
        "refs/tags/5.0.23",
        "refs/tags/5.0.3",
        "refs/tags/5.0.4",
        "refs/tags/5.0.5",
        "refs/tags/5.0.6",
        "refs/tags/5.0.7",
        "refs/tags/5.0.8",
        "refs/tags/5.0.9",
        "refs/tags/6.0.0",
        "refs/tags/6.0.1",
        "refs/tags/6.0.2",
        "refs/tags/6.0.3",
        "refs/tags/6.0.4",
        "refs/tags/6.0.5",
        "refs/tags/6.0.6",
        "refs/tags/6.0.7",
        "refs/tags/6.0.8",
        "refs/tags/6.0.9",
        "refs/tags/6.1.0",
        "refs/tags/6.1.1",
        "refs/tags/6.1.2"
      ],
      "retentionOwner": "ui-router-maintainers",
      "evidence": {
        "path": "migration/control-evidence/execution-lock/core.json",
        "sha256": "b38b277eb0abb2079fc73cfd6bc651e635e0755e692914561fa7c180e1d0deb7"
      }
    },
    {
      "name": "dsr",
      "defaultHead": "0fc6644008842790681bc08f1887a530d7120cfb",
      "tagSnapshotSha256": "dfecd363f7d4c43416f59f1f37ec7d835f5c27a1de29f281838bc76ae3dd3e03",
      "mirrorPath": ".migration-work/sources/dsr.git",
      "bundlePath": ".migration-work/bundles/dsr.bundle",
      "bundleSha256": "aa1eda3ea2c68e30ce15b70b667160ad8cebfaa0c9cebd634b27a1867199509d",
      "objectFormat": "sha1",
      "includedRefs": [
        "refs/heads/master",
        "refs/tags/1.0.0",
        "refs/tags/1.0.1",
        "refs/tags/1.0.2",
        "refs/tags/1.0.3",
        "refs/tags/1.1.0",
        "refs/tags/1.1.1",
        "refs/tags/1.2.0"
      ],
      "retentionOwner": "ui-router-maintainers",
      "evidence": {
        "path": "migration/control-evidence/execution-lock/dsr.json",
        "sha256": "fb05e85c63b2621a9b6c7195108c7fda1aa6f7c9042ada1d70f425bde73e18df"
      }
    },
    {
      "name": "rx",
      "defaultHead": "a54028d5d1aba03e8778e4711fc70d006fdc1898",
      "tagSnapshotSha256": "b462792dfc804e6fc4d779a9956fa3af3e6da33b0e33e1e30d3be021fa44e1ef",
      "mirrorPath": ".migration-work/sources/rx.git",
      "bundlePath": ".migration-work/bundles/rx.bundle",
      "bundleSha256": "febe72befd62c3108936cf71be15030368326b3e610a1a92755d719e5fefc97e",
      "objectFormat": "sha1",
      "includedRefs": [
        "refs/heads/master",
        "refs/tags/0.2.0",
        "refs/tags/0.2.1",
        "refs/tags/0.3.0",
        "refs/tags/0.3.1",
        "refs/tags/0.3.2",
        "refs/tags/0.4.1",
        "refs/tags/0.4.2",
        "refs/tags/0.4.4",
        "refs/tags/0.4.5",
        "refs/tags/0.5.0",
        "refs/tags/0.6.0",
        "refs/tags/0.6.2",
        "refs/tags/0.6.4",
        "refs/tags/0.6.5",
        "refs/tags/1.0.0"
      ],
      "retentionOwner": "ui-router-maintainers",
      "evidence": {
        "path": "migration/control-evidence/execution-lock/rx.json",
        "sha256": "53df52663b70279a6b49caa3e684d89a79bec7fb8bcb729a3edb6b08492d6f55"
      }
    },
    {
      "name": "redux",
      "defaultHead": "61610a4df2fc191e079ee3cc8c81a651aa86341a",
      "tagSnapshotSha256": "98329b82c60ab75dde4c816080df271ee04fd0c3ba0dc312b14e22fad2a9413f",
      "mirrorPath": ".migration-work/sources/redux.git",
      "bundlePath": ".migration-work/bundles/redux.bundle",
      "bundleSha256": "ed31f06d2dd10db88c6a86e776c14ab22d51bbc7d8e499161f405551d2a8606b",
      "objectFormat": "sha1",
      "includedRefs": [
        "refs/heads/master",
        "refs/tags/1.0.0"
      ],
      "retentionOwner": "ui-router-maintainers",
      "evidence": {
        "path": "migration/control-evidence/execution-lock/redux.json",
        "sha256": "8cfc8d3fe9eb6853918ef49750e056b71c2a0056e14c67954803cb2a07bbedfa"
      }
    },
    {
      "name": "sticky-states",
      "defaultHead": "818914c029e2602e6bd5897cd0bdbe6a90c9f1da",
      "tagSnapshotSha256": "a8efaa5c64b278ca1bcf7a82fdc97428a13af7b0643a386e95ebdb6ba7ec15ab",
      "mirrorPath": ".migration-work/sources/sticky-states.git",
      "bundlePath": ".migration-work/bundles/sticky-states.bundle",
      "bundleSha256": "c09bc5a29f562fdfc7af07e78ab6acf1d7de96d3b5bb9f361048098e1ccf148c",
      "objectFormat": "sha1",
      "includedRefs": [
        "refs/heads/master",
        "refs/tags/1.0.0",
        "refs/tags/1.2.0",
        "refs/tags/1.3.0",
        "refs/tags/1.4.0",
        "refs/tags/1.4.1",
        "refs/tags/1.5.0",
        "refs/tags/1.5.1"
      ],
      "retentionOwner": "ui-router-maintainers",
      "evidence": {
        "path": "migration/control-evidence/execution-lock/sticky-states.json",
        "sha256": "4bc5977dda13fb1cb59df41be42ee36a1f3a840adacf96313ac15f57eac3e4b4"
      }
    },
    {
      "name": "visualizer",
      "defaultHead": "d95f266364aeba3ba082724cc33faa9fa9d82ac3",
      "tagSnapshotSha256": "ef60b465ba10dc53b6c5ea76a5dfb223c95b8ba2c3ad8bf4ec9122d17b342cef",
      "mirrorPath": ".migration-work/sources/visualizer.git",
      "bundlePath": ".migration-work/bundles/visualizer.bundle",
      "bundleSha256": "72f58b0af26d477af867330965b0530575d5cfd1f2673df815751dcdc3441af4",
      "objectFormat": "sha1",
      "includedRefs": [
        "refs/heads/master",
        "refs/tags/1.0.0",
        "refs/tags/1.1.0",
        "refs/tags/1.1.1",
        "refs/tags/1.1.2",
        "refs/tags/1.1.3",
        "refs/tags/2.0.1",
        "refs/tags/2.0.10",
        "refs/tags/2.0.11",
        "refs/tags/2.0.3",
        "refs/tags/2.0.4",
        "refs/tags/2.0.5",
        "refs/tags/2.0.7",
        "refs/tags/2.0.8",
        "refs/tags/2.0.9",
        "refs/tags/3.0.0",
        "refs/tags/3.1.0",
        "refs/tags/3.1.1",
        "refs/tags/3.1.2",
        "refs/tags/3.1.3",
        "refs/tags/4.0.0",
        "refs/tags/4.0.1",
        "refs/tags/4.0.2",
        "refs/tags/5.0.0",
        "refs/tags/5.0.1",
        "refs/tags/5.0.2",
        "refs/tags/5.0.3",
        "refs/tags/5.0.4",
        "refs/tags/5.0.5",
        "refs/tags/5.0.6",
        "refs/tags/5.1.0",
        "refs/tags/5.1.1",
        "refs/tags/5.1.2",
        "refs/tags/5.1.3",
        "refs/tags/6.0.0",
        "refs/tags/6.0.2",
        "refs/tags/6.0.3",
        "refs/tags/7.0.0",
        "refs/tags/7.1.0",
        "refs/tags/7.2.0",
        "refs/tags/7.2.1"
      ],
      "retentionOwner": "ui-router-maintainers",
      "evidence": {
        "path": "migration/control-evidence/execution-lock/visualizer.json",
        "sha256": "cf40717dabee79365501d795fe1f576e9defb2149d2af4df1aeb1594459b22db"
      }
    },
    {
      "name": "angularjs",
      "defaultHead": "99a1232907edc2a673c1131b56f7b52054c56c0a",
      "tagSnapshotSha256": "94047ef99269f8abbc2668196ed85adb264939cb56fe2fed543e80dbaf20a587",
      "mirrorPath": ".migration-work/sources/angularjs.git",
      "bundlePath": ".migration-work/bundles/angularjs.bundle",
      "bundleSha256": "9b4ad6b5470c5dc2836baada0b43cf42497bdcb88b4edfd17b409350f7a35485",
      "objectFormat": "sha1",